08:14:42.348516 ARP, Request who-has 140.116.164.125 tell 140.116.164.85, length 28
08:14:42.549280 ARP, Request who-has 140.116.164.125 tell 140.116.164.85, length 28
08:14:43.237338 IP 211.72.192.30.8444 > 140.116.164.86.62537: UDP, length 436
08:14:43.282603 IP 140.116.164.86.51636 > 203.117.158.170.9101: UDP, length 5
08:14:43.297388 IP 211.72.192.30.8444 > 140.116.164.86.62537: UDP, length 430
08:14:43.309941 IP 140.116.164.86.17500 > 255.255.255.255.17500: UDP, length 119
08:14:43.310493 IP 140.116.164.86.17500 > 140.116.164.127.17500: UDP, length 119
08:14:43.343047 IP 69.171.246.16.80 > 140.116.164.97.55546: Flags [P.], seq 2226618919:2226619686, ack 1131943935, win 64240, length 767
08:14:43.348447 ARP, Request who-has 140.116.164.125 tell 140.116.164.85, length 28
08:14:43.376579 IP 91.189.92.184.80 > 192.168.3.147.55928: Flags [P.], seq 1754521980:1754523440, ack 991299902, win 11680, length 1460
08:14:43.376588 IP 91.189.92.184.80 > 192.168.3.147.55928: Flags [P.], seq 1460:2920, ack 1, win 11680, length 1460
08:14:43.377385 IP 192.168.3.147.55928 > 91.189.92.184.80: Flags [.], ack 1460, win 65535, length 0
08:14:43.377390 IP 192.168.3.147.55928 > 91.189.92.184.80: Flags [.], ack 2920, win 65535, length 0
08:14:43.377688 IP 91.189.92.184.80 > 192.168.3.147.55928: Flags [P.], seq 2920:4380, ack 1, win 11680, length 1460
08:14:43.377751 IP 91.189.92.184.80 > 192.168.3.147.55928: Flags [P.], seq 4380:5840, ack 1, win 11680, length 1460
08:14:43.377818 IP 211.72.192.30.8444 > 140.116.164.86.62537: UDP, length 433
08:14:43.378356 IP 192.168.3.147.55928 > 91.189.92.184.80: Flags [.], ack 4380, win 65535, length 0
08:14:43.378418 IP 192.168.3.147.55928 > 91.189.92.184.80: Flags [.], ack 5840, win 65535, length 0
08:14:43.383469 IP 140.116.177.155.1900 > 239.255.255.250.1900: UDP, length 351
08:14:43.384775 IP 140.116.164.97.55546 > 69.171.246.16.80: Flags [.], seq 1:1461, ack 767, win 65535, length 1460
08:14:43.384837 IP 140.116.164.97.55546 > 69.171.246.16.80: Flags [P.], seq 1461:2423, ack 767, win 65535, length 962
08:14:43.394885 IP 91.189.92.184.80 > 192.168.3.147.55928: Flags [P.], seq 5840:7300, ack 1, win 11680, length 1460
08:14:43.395435 IP 91.189.92.184.80 > 192.168.3.147.55928: Flags [P.], seq 7300:8760, ack 1, win 11680, length 1460
08:14:43.395496 IP 192.168.3.147.55928 > 91.189.92.184.80: Flags [.], ack 7300, win 65535, length 0
08:14:43.395788 IP 91.189.92.184.80 > 192.168.3.147.55928: Flags [P.], seq 8760:10220, ack 1, win 11680, length 1460
08:14:43.395851 IP 91.189.92.184.80 > 192.168.3.147.55928: Flags [P.], seq 10220:11680, ack 1, win 11680, length 1460
08:14:43.396141 IP 192.168.3.147.55928 > 91.189.92.184.80: Flags [.], ack 8760, win 65535, length 0
08:14:43.396204 IP 91.189.92.184.80 > 192.168.3.147.55928: Flags [P.], seq 11680:13140, ack 1, win 11680, length 1460
08:14:43.396496 IP 91.189.92.184.80 > 192.168.3.147.55928: Flags [P.], seq 13140:14600, ack 1, win 11680, length 1460
08:14:43.396557 IP 192.168.3.147.55928 > 91.189.92.184.80: Flags [.], ack 10220, win 65535, length 0
08:14:43.396857 IP 192.168.3.147.55928 > 91.189.92.184.80: Flags [.], ack 11680, win 65535, length 0
08:14:43.397156 IP 192.168.3.147.55928 > 91.189.92.184.80: Flags [.], ack 14600, win 65535, length 0
08:14:43.459210 IP 211.72.192.30.8444 > 140.116.164.86.62537: UDP, length 462
08:14:43.479253 IP 140.116.164.71.3389 > 223.139.159.50.50472: Flags [P.], seq 3994898103:3994898188, ack 2392713198, win 64712, length 85
08:14:43.479258 IP 211.72.192.30.8444 > 140.116.164.86.54079: Flags [P.], seq 419400623:419400656, ack 306790872, win 46, length 33
08:14:43.483804 IP 140.116.164.74.6699 > 172.168.10.1.9900: UDP, length 17
08:14:43.492857 IP 211.72.192.30.8444 > 140.116.164.86.54079: Flags [P.], seq 33:169, ack 1, win 46, length 136
08:14:43.492862 IP 140.116.164.86.54079 > 211.72.192.30.8444: Flags [.], ack 169, win 16316, length 0
08:14:43.539153 IP 211.72.192.30.8444 > 140.116.164.86.62537: UDP, length 423
08:14:43.564945 IP 126.214.14.162.49654 > 140.116.164.83.5173: Flags [S], seq 4078267692, win 65535, options [mss 1410,nop,wscale 4,nop,nop,TS val 569741043 ecr 0,sackOK,eol], length 0
08:14:43.565006 IP 140.116.164.83.5173 > 126.214.14.162.49654: Flags [S.], seq 4111107146, ack 4078267693, win 8192, options [mss 1460,nop,wscale 8,sackOK,TS val 10151097 ecr 569741043], length 0
08:14:43.619022 IP 211.72.192.30.8444 > 140.116.164.86.62537: UDP, length 438
08:14:43.669050 IP 69.171.246.16.80 > 140.116.164.97.55546: Flags [.], ack 2423, win 64240, length 0
08:14:43.669112 IP 69.171.246.16.80 > 140.116.164.97.55546: Flags [.], ack 1461, win 64240, length 0
08:14:43.671665 IP 91.189.92.184.80 > 192.168.3.147.55928: Flags [P.], seq 14600:16060, ack 1, win 11680, length 1460
08:14:43.671728 IP 91.189.92.184.80 > 192.168.3.147.55928: Flags [P.], seq 16060:17520, ack 1, win 11680, length 1460
08:14:43.672022 IP 91.189.92.184.80 > 192.168.3.147.55928: Flags [P.], seq 17520:18980, ack 1, win 11680, length 1460
08:14:43.672090 IP 91.189.92.184.80 > 192.168.3.147.55928: Flags [P.], seq 18980:20440, ack 1, win 11680, length 1460
08:14:43.672624 IP 192.168.3.147.55928 > 91.189.92.184.80: Flags [.], ack 17520, win 65535, length 0
08:14:43.672930 IP 192.168.3.147.55928 > 91.189.92.184.80: Flags [.], ack 20440, win 65535, length 0
08:14:43.689241 IP 91.189.92.184.80 > 192.168.3.147.55928: Flags [P.], seq 20440:21900, ack 1, win 11680, length 1460
08:14:43.689792 IP 91.189.92.184.80 > 192.168.3.147.55928: Flags [P.], seq 21900:23360, ack 1, win 11680, length 1460
08:14:43.689862 IP 91.189.92.184.80 > 192.168.3.147.55928: Flags [P.], seq 23360:24820, ack 1, win 11680, length 1460
08:14:43.690156 IP 91.189.92.184.80 > 192.168.3.147.55928: Flags [P.], seq 24820:26280, ack 1, win 11680, length 1460
08:14:43.690459 IP 91.189.92.184.80 > 192.168.3.147.55928: Flags [P.], seq 26280:27740, ack 1, win 11680, length 1460
08:14:43.690528 IP 91.189.92.184.80 > 192.168.3.147.55928: Flags [P.], seq 27740:29200, ack 1, win 11680, length 1460
08:14:43.690588 IP 192.168.3.147.55928 > 91.189.92.184.80: Flags [.], ack 23360, win 65535, length 0
08:14:43.690877 IP 192.168.3.147.55928 > 91.189.92.184.80: Flags [.], ack 26280, win 65535, length 0
08:14:43.691432 IP 192.168.3.147.55928 > 91.189.92.184.80: Flags [.], ack 29200, win 65535, length 0
08:14:43.693992 IP 126.214.14.162.49654 > 140.116.164.83.5173: Flags [.], ack 1, win 8213, options [nop,nop,TS val 569741214 ecr 10151097], length 0
08:14:43.701549 IP 211.72.192.30.8444 > 140.116.164.86.62537: UDP, length 437
08:14:43.710847 IP 126.214.14.162.49654 > 140.116.164.83.5173: Flags [P.], seq 1:101, ack 1, win 8213, options [nop,nop,TS val 569741221 ecr 10151097], length 100
08:14:43.711903 IP 140.116.164.83.5173 > 126.214.14.162.49654: Flags [P.], seq 1:83, ack 101, win 256, options [nop,nop,TS val 10151112 ecr 569741221], length 82
08:14:43.728702 IP 140.116.178.129.1900 > 239.255.255.250.1900: UDP, length 351
08:14:43.737253 IP 23.32.248.83.80 > 140.116.164.85.34393: Flags [P.], ack 86738340, win 14600, length 0
08:14:43.737259 IP 140.116.164.85.34393 > 23.32.248.83.80: Flags [.], ack 1, win 64240, length 0
08:14:43.746556 IP 203.69.67.197.80 > 140.116.164.95.62604: Flags [P.], ack 632886434, win 11680, length 0
08:14:43.746564 IP 140.116.164.95.62604 > 203.69.67.197.80: Flags [.], ack 1, win 63894, length 0
08:14:43.759610 IP 140.116.164.83.60156 > 203.117.158.175.9101: UDP, length 5
08:14:43.759905 IP 223.139.159.50.50472 > 140.116.164.71.3389: Flags [.], ack 85, win 64191, length 0
08:14:43.792466 IP 140.116.49.221.1900 > 239.255.255.250.1900: UDP, length 350
08:14:43.798870 ARP, Request who-has 140.116.164.125 tell 140.116.164.85, length 28
08:14:43.821242 IP 211.72.192.30.8444 > 140.116.164.86.62537: UDP, length 466
08:14:43.822543 IP 126.214.14.162.49654 > 140.116.164.83.5173: Flags [.], ack 83, win 8208, options [nop,nop,TS val 569741362 ecr 10151112], length 0
08:14:43.822850 IP 140.116.164.83.5173 > 126.214.14.162.49654: Flags [P.], seq 83:91, ack 101, win 256, options [nop,nop,TS val 10151123 ecr 569741362], length 8
08:14:43.839153 IP 126.214.14.162.49654 > 140.116.164.83.5173: Flags [P.], seq 101:109, ack 83, win 8208, options [nop,nop,TS val 569741367 ecr 10151112], length 8
08:14:43.862447 IP 211.72.192.30.8444 > 140.116.164.86.62537: UDP, length 453
08:14:43.881491 IP 108.160.161.164.80 > 140.116.164.74.56370: Flags [P.], ack 1081191434, win 14600, length 0
08:14:43.881496 IP 199.47.219.149.80 > 140.116.164.95.62405: Flags [P.], ack 55274384, win 11680, length 0
08:14:43.881785 IP 125.56.201.120.80 > 140.116.164.85.34391: Flags [P.], ack 2824789479, win 14600, length 0
08:14:43.881854 IP 140.116.164.95.62405 > 199.47.219.149.80: Flags [.], ack 1, win 64061, length 0
08:14:43.881901 IP 140.116.164.85.34391 > 125.56.201.120.80: Flags [.], ack 1, win 63257, length 0
08:14:43.883441 IP 140.116.164.74.56370 > 108.160.161.164.80: Flags [.], ack 1, win 16985, length 0
08:14:43.888755 IP 140.116.164.95.59377 > 140.116.164.109.22: Flags [P.], seq 1494485605:1494485657, ack 777749535, win 16425, length 52
08:14:43.891309 IP 140.116.164.109.22 > 140.116.164.95.59377: Flags [P.], seq 1:549, ack 52, win 731, length 548
08:14:43.902111 IP 211.72.192.30.8444 > 140.116.164.86.62537: UDP, length 440
08:14:43.930399 IP 207.109.73.106.80 > 140.116.164.85.34399: Flags [P.], ack 2762803214, win 14600, length 0
08:14:43.930406 IP 140.116.164.85.34399 > 207.109.73.106.80: Flags [.], ack 1, win 64240, length 0
08:14:43.930952 IP 140.116.164.95.17500 > 255.255.255.255.17500: UDP, length 177
08:14:43.931253 IP 54.248.118.168.80 > 140.116.164.73.4432: Flags [P.], ack 2983695929, win 11680, length 0
08:14:43.932557 IP 140.116.164.73.4432 > 54.248.118.168.80: Flags [.], ack 1, win 5840, length 0
08:14:43.932616 IP 140.116.164.95.17500 > 140.116.164.127.17500: UDP, length 177
08:14:43.935918 IP 126.214.14.162.49654 > 140.116.164.83.5173: Flags [.], ack 91, win 8207, options [nop,nop,TS val 569741458 ecr 10151123], length 0
08:14:43.935977 IP 140.116.164.83.5173 > 126.214.14.162.49654: Flags [P.], seq 91:143, ack 109, win 256, options [nop,nop,TS val 10151134 ecr 569741367], length 52
08:14:43.939784 IP 140.116.164.96.138 > 140.116.164.127.138: NBT UDP PACKET(138)
08:14:43.942585 IP 211.72.192.30.8444 > 140.116.164.86.62537: UDP, length 421
08:14:43.966888 IP 91.189.92.184.80 > 192.168.3.147.55928: Flags [P.], seq 29200:30660, ack 1, win 11680, length 1460
08:14:43.967180 IP 91.189.92.184.80 > 192.168.3.147.55928: Flags [P.], seq 30660:32120, ack 1, win 11680, length 1460
08:14:43.967252 IP 91.189.92.184.80 > 192.168.3.147.55928: Flags [P.], seq 32120:33580, ack 1, win 11680, length 1460
08:14:43.967548 IP 91.189.92.184.80 > 192.168.3.147.55928: Flags [P.], seq 33580:35040, ack 1, win 11680, length 1460
